{
  "schemaVersion": 2,
  "contentRevision": "ws-content-r2",
  "domain": "discoveries",
  "records": [
    {
      "id": "C01",
      "canonicalId": "DISC-C01",
      "sourceDocumentId": "DISC-LIST-001",
      "enabled": true,
      "kind": "CORE",
      "name": "생존 재료의 공통 구조",
      "recommendedDayMin": 1,
      "recommendedDayMax": 1,
      "prerequisiteIds": [],
      "primaryPath": "목재·돌·식량 세 범주를 획득하고 서로 다른 기본 도구 2개 사용",
      "alternativePath": "자연 상자·폐허에서 기본 도구를 회수하고 모닥불 또는 화로 사용",
      "unlockText": "휴대 제작 메뉴, 기본 생존 조합 범주",
      "clueText": "서로 다른 재료를 얻을 때 질감·내구 차이 안내",
      "stateMachine": [
        "HIDDEN",
        "CLUE",
        "HYPOTHESIS",
        "EXPERIMENT",
        "DISCOVERED",
        "MASTERED"
      ]
    },
    {
      "id": "C02",
      "canonicalId": "DISC-C02",
      "sourceDocumentId": "DISC-LIST-001",
      "enabled": true,
      "kind": "CORE",
      "name": "현장 가공",
      "recommendedDayMin": 1,
      "recommendedDayMax": 2,
      "prerequisiteIds": [
        "C01"
      ],
      "primaryPath": "화로로 원석 제련, 모닥불로 식량 가공, 작업대로 부품 제작",
      "alternativePath": "폐허 금속품 3개 분해 후 현장 가공 도구 사용",
      "unlockText": "휴대 분해·기초 수리·기초 합금",
      "clueText": "제련 또는 분해 시 `형태는 달라도 쓸 수 있는 성분이 남는다`",
      "stateMachine": [
        "HIDDEN",
        "CLUE",
        "HYPOTHESIS",
        "EXPERIMENT",
        "DISCOVERED",
        "MASTERED"
      ]
    },
    {
      "id": "C03",
      "canonicalId": "DISC-C03",
      "sourceDocumentId": "DISC-LIST-001",
      "enabled": true,
      "kind": "CORE",
      "name": "장비 프레임",
      "recommendedDayMin": 2,
      "recommendedDayMax": 3,
      "prerequisiteIds": [
        "C02"
      ],
      "primaryPath": "검·도끼·활·곡괭이 중 서로 다른 무기군 2종으로 유효 공격",
      "alternativePath": "철·가죽·실 범주의 재료를 모아 장비 GUI에서 프레임 시제품 검사",
      "unlockText": "커스텀 장비 GUI, 일반 등급 제작, 장비 분해",
      "clueText": "",
      "stateMachine": [
        "HIDDEN",
        "CLUE",
        "HYPOTHESIS",
        "EXPERIMENT",
        "DISCOVERED",
        "MASTERED"
      ]
    },
    {
      "id": "C04",
      "canonicalId": "DISC-C04",
      "sourceDocumentId": "DISC-LIST-001",
      "enabled": true,
      "kind": "CORE",
      "name": "이상 잔류물",
      "recommendedDayMin": 3,
      "recommendedDayMax": 4,
      "prerequisiteIds": [
        "C01"
      ],
      "primaryPath": "오염 적 또는 이상 현상에서 서로 다른 표본 2종 획득",
      "alternativePath": "오염 지역에서 30초 생존하고 영향받은 식생·돌 표본 채취",
      "unlockText": "표본 보관, 미확인 물질 분석 탭",
      "clueText": "오염 소리·입자·변색된 바닐라 블록 조합",
      "stateMachine": [
        "HIDDEN",
        "CLUE",
        "HYPOTHESIS",
        "EXPERIMENT",
        "DISCOVERED",
        "MASTERED"
      ]
    },
    {
      "id": "C05",
      "canonicalId": "DISC-C05",
      "sourceDocumentId": "DISC-LIST-001",
      "enabled": true,
      "kind": "CORE",
      "name": "공명 반응",
      "recommendedDayMin": 4,
      "recommendedDayMax": 6,
      "prerequisiteIds": [
        "C02",
        "C04"
      ],
      "primaryPath": "구리·레드스톤·오염 표본을 분석 도구에 함께 투입",
      "alternativePath": "자수정 계열 재료와 오염 적 결정핵으로 반응 실험 3회",
      "unlockText": "휴대 공명 탐지기, 신호 강도 UI",
      "clueText": "",
      "stateMachine": [
        "HIDDEN",
        "CLUE",
        "HYPOTHESIS",
        "EXPERIMENT",
        "DISCOVERED",
        "MASTERED"
      ]
    },
    {
      "id": "C06",
      "canonicalId": "DISC-C06",
      "sourceDocumentId": "DISC-LIST-001",
      "enabled": true,
      "kind": "CORE",
      "name": "신호 삼각 측정",
      "recommendedDayMin": 6,
      "recommendedDayMax": 8,
      "prerequisiteIds": [
        "C05"
      ],
      "primaryPath": "서로 48블록 이상 떨어진 위치에서 공명 강도 3회 측정",
      "alternativePath": "관측 시설 하나를 건설하고 휴대 탐지기 측정 1회 결합",
      "unlockText": "첫 보스 신호 조립식, 동적 전장 후보 검사",
      "clueText": "",
      "stateMachine": [
        "HIDDEN",
        "CLUE",
        "HYPOTHESIS",
        "EXPERIMENT",
        "DISCOVERED",
        "MASTERED"
      ]
    },
    {
      "id": "C07",
      "canonicalId": "DISC-C07",
      "sourceDocumentId": "DISC-LIST-001",
      "enabled": true,
      "kind": "CORE",
      "name": "생체 공명체 호출",
      "recommendedDayMin": 9,
      "recommendedDayMax": 10,
      "prerequisiteIds": [
        "C03",
        "C06"
      ],
      "primaryPath": "신호 장치, 안정된 공간, 파티 준비 확인 후 호출",
      "alternativePath": "관측 시설이 파괴됐으면 휴대 신호기 2개를 순차 사용",
      "unlockText": "Day 10 보스 전장, 처치 후 재건 부품 A와 첫 고유 장비 투표",
      "clueText": "",
      "stateMachine": [
        "HIDDEN",
        "CLUE",
        "HYPOTHESIS",
        "EXPERIMENT",
        "DISCOVERED",
        "MASTERED"
      ]
    },
    {
      "id": "C08",
      "canonicalId": "DISC-C08",
      "sourceDocumentId": "DISC-LIST-001",
      "enabled": true,
      "kind": "CORE",
      "name": "신체 반응 기록",
      "recommendedDayMin": 11,
      "recommendedDayMax": 12,
      "prerequisiteIds": [
        "C07"
      ],
      "primaryPath": "서로 다른 해로운 상태 3종을 경험하고 생존",
      "alternativePath": "상태 표본 2종과 일반 의약 재료를 연구 도구로 분석",
      "unlockText": "상태 도감, 지속시간·정화 범주 표시",
      "clueText": "",
      "stateMachine": [
        "HIDDEN",
        "CLUE",
        "HYPOTHESIS",
        "EXPERIMENT",
        "DISCOVERED",
        "MASTERED"
      ]
    },
    {
      "id": "C09",
      "canonicalId": "DISC-C09",
      "sourceDocumentId": "DISC-LIST-001",
      "enabled": true,
      "kind": "CORE",
      "name": "중화 원리",
      "recommendedDayMin": 12,
      "recommendedDayMax": 14,
      "prerequisiteIds": [
        "C08"
      ],
      "primaryPath": "독·화상·출혈 중 두 종류를 서로 다른 방법으로 해제",
      "alternativePath": "우유·꿀·약초·정화 표본 중 세 범주를 조합 실험",
      "unlockText": "해독제, 화상 억제제, 지혈 도구의 범주 제작식",
      "clueText": "",
      "stateMachine": [
        "HIDDEN",
        "CLUE",
        "HYPOTHESIS",
        "EXPERIMENT",
        "DISCOVERED",
        "MASTERED"
      ]
    },
    {
      "id": "C10",
      "canonicalId": "DISC-C10",
      "sourceDocumentId": "DISC-LIST-001",
      "enabled": true,
      "kind": "CORE",
      "name": "빈사 생체 신호",
      "recommendedDayMin": 13,
      "recommendedDayMax": 15,
      "prerequisiteIds": [
        "C08"
      ],
      "primaryPath": "파티원이 빈사 상태에서 도움 요청 후 정상 구조 성공",
      "alternativePath": "훈련 단말의 모의 구조를 두 명이 완료",
      "unlockText": "구조 보조 도구, 자동 구조 시설 연구",
      "clueText": "",
      "stateMachine": [
        "HIDDEN",
        "CLUE",
        "HYPOTHESIS",
        "EXPERIMENT",
        "DISCOVERED",
        "MASTERED"
      ]
    },
    {
      "id": "C11",
      "canonicalId": "DISC-C11",
      "sourceDocumentId": "DISC-LIST-001",
      "enabled": true,
      "kind": "CORE",
      "name": "상태 관측 배열",
      "recommendedDayMin": 15,
      "recommendedDayMax": 17,
      "prerequisiteIds": [
        "C09"
      ],
      "primaryPath": "연구 단말에서 세 상태 표본의 강도·지속시간 비교",
      "alternativePath": "전투 중 상태 해제·구조·저항 성공 기록을 합계 5회 확보",
      "unlockText": "관측 시설 2단계, 적 상태 예고, 치료 시설",
      "clueText": "",
      "stateMachine": [
        "HIDDEN",
        "CLUE",
        "HYPOTHESIS",
        "EXPERIMENT",
        "DISCOVERED",
        "MASTERED"
      ]
    },
    {
      "id": "C12",
      "canonicalId": "DISC-C12",
      "sourceDocumentId": "DISC-LIST-001",
      "enabled": true,
      "kind": "CORE",
      "name": "연쇄 제어 한계",
      "recommendedDayMin": 17,
      "recommendedDayMax": 19,
      "prerequisiteIds": [
        "C11"
      ],
      "primaryPath": "강한 CC 체인이 3초에 도달한 기록과 면역 발생 관찰",
      "alternativePath": "훈련 단말에서 3초 체인 모의 실험 완료",
      "unlockText": "TENACITY 분석, 제어 해제 후 0.5초 면역 설명",
      "clueText": "",
      "stateMachine": [
        "HIDDEN",
        "CLUE",
        "HYPOTHESIS",
        "EXPERIMENT",
        "DISCOVERED",
        "MASTERED"
      ]
    },
    {
      "id": "C13",
      "canonicalId": "DISC-C13",
      "sourceDocumentId": "DISC-LIST-001",
      "enabled": true,
      "kind": "CORE",
      "name": "변형 생체 호출",
      "recommendedDayMin": 19,
      "recommendedDayMax": 20,
      "prerequisiteIds": [
        "C09",
        "C10",
        "C11"
      ],
      "primaryPath": "치료·상태 대응 물품 세 범주를 신호 장치에 등록",
      "alternativePath": "구조 성공·정화 성공·상태 저항 기록으로 대응 검증",
      "unlockText": "Day 20 보스 전장, 재건 부품 B, 두 번째 고유 장비 투표",
      "clueText": "",
      "stateMachine": [
        "HIDDEN",
        "CLUE",
        "HYPOTHESIS",
        "EXPERIMENT",
        "DISCOVERED",
        "MASTERED"
      ]
    },
    {
      "id": "C14",
      "canonicalId": "DISC-C14",
      "sourceDocumentId": "DISC-LIST-001",
      "enabled": true,
      "kind": "CORE",
      "name": "변이 조직 분류",
      "recommendedDayMin": 21,
      "recommendedDayMax": 22,
      "prerequisiteIds": [
        "C13"
      ],
      "primaryPath": "조직·골편·결정 계열 변이 표본 3범주 분석",
      "alternativePath": "서로 다른 오염 사건 3종을 관찰하고 생존",
      "unlockText": "오염 변이 도감, 표본 정제",
      "clueText": "",
      "stateMachine": [
        "HIDDEN",
        "CLUE",
        "HYPOTHESIS",
        "EXPERIMENT",
        "DISCOVERED",
        "MASTERED"
      ]
    },
    {
      "id": "C15",
      "canonicalId": "DISC-C15",
      "sourceDocumentId": "DISC-LIST-001",
      "enabled": true,
      "kind": "CORE",
      "name": "자연 정화 현상",
      "recommendedDayMin": 22,
      "recommendedDayMax": 24,
      "prerequisiteIds": [
        "C04",
        "C14"
      ],
      "primaryPath": "자연 정화 노드에서 오염 감소 전후 측정",
      "alternativePath": "물·자수정·금속 촉매 조합 중 유효 정화 반응 발견",
      "unlockText": "정화 촉매와 개인 정화 원리",
      "clueText": "",
      "stateMachine": [
        "HIDDEN",
        "CLUE",
        "HYPOTHESIS",
        "EXPERIMENT",
        "DISCOVERED",
        "MASTERED"
      ]
    },
    {
      "id": "C16",
      "canonicalId": "DISC-C16",
      "sourceDocumentId": "DISC-LIST-001",
      "enabled": true,
      "kind": "CORE",
      "name": "휴대 정화",
      "recommendedDayMin": 23,
      "recommendedDayMax": 25,
      "prerequisiteIds": [
        "C15"
      ],
      "primaryPath": "정화 촉매를 사용해 개인 오염 단계 1회 하락",
      "alternativePath": "작은 임시 정화장을 만들고 30초 유지",
      "unlockText": "휴대 정화기, 응급 정화 소모품",